{
  "schema_version": 2,
  "runtime": "android-proot",
  "platform": "android",
  "abi": "arm64",
  "rootfs_version": "3.24.2",
  "content_sha256": "1111111111111111111111111111111111111111111111111111111111111111",
  "sbom_filename": "rootfs.spdx.json",
  "source_pins_filename": "mobile-linux-pins.json",
  "archive": {
    "filename": "rootfs.tar.gz",
    "sha256": "0000000000000000000000000000000000000000000000000000000000000000",
    "size_bytes": 0
  },
  "packages": [
    {
      "name": "apk-tools",
      "version": "REPLACE_WITH_REAL_VERSION",
      "license": "REPLACE_WITH_REAL_LICENSE",
      "architecture": "arm64",
      "origin": "apk-tools"
    },
    {
      "name": "busybox",
      "version": "REPLACE_WITH_REAL_VERSION",
      "license": "REPLACE_WITH_REAL_LICENSE",
      "architecture": "arm64",
      "origin": "busybox"
    },
    {
      "name": "ca-certificates",
      "version": "20260909-r0",
      "license": "MPL-2.0 AND MIT",
      "architecture": "arm64",
      "origin": "ca-certificates"
    },
    {
      "name": "git",
      "version": "2.54.0-r0",
      "license": "GPL-2.0-only",
      "architecture": "arm64",
      "origin": "git"
    },
    {
      "name": "node-source",
      "version": "26.9.0",
      "license": "MIT",
      "architecture": "arm64",
      "origin": "https://nodejs.org/dist/v26.9.0/node-v26.9.0.tar.xz"
    },
    {
      "name": "npm",
      "version": "12.0.2",
      "license": "Artistic-2.0",
      "architecture": "arm64",
      "origin": "https://registry.npmjs.org/npm/-/npm-12.0.2.tgz"
    },
    {
      "name": "openssh-client-default",
      "version": "10.3_p1-r1",
      "license": "SSH-OpenSSH",
      "architecture": "arm64",
      "origin": "openssh"
    },
    {
      "name": "py3-pip",
      "version": "26.1.2-r0",
      "license": "MIT",
      "architecture": "arm64",
      "origin": "py3-pip"
    },
    {
      "name": "py3-virtualenv",
      "version": "21.3.3-r0",
      "license": "MIT",
      "architecture": "arm64",
      "origin": "py3-virtualenv"
    },
    {
      "name": "python3",
      "version": "3.14.7-r1",
      "license": "PSF-2.0",
      "architecture": "arm64",
      "origin": "python3"
    },
    {
      "name": "typescript-native",
      "version": "7.0.2",
      "license": "Apache-2.0",
      "architecture": "aarch64",
      "origin": "@typescript/typescript-linux-arm64"
    },
    {
      "name": "pnpm",
      "version": "12.5.1",
      "license": "MIT",
      "architecture": "arm64",
      "origin": "https://registry.npmjs.org/pnpm/-/pnpm-12.5.1.tgz"
    }
  ],
  "executable_allowlist": [
    {
      "path": "/bin/busybox",
      "sha256": "aaaaaaaaaaaaaaaaaaaaaaaaaaaaaaaaaaaaaaaaaaaaaaaaaaaaaaaaaaaaaaaa",
      "kind": "interpreter"
    },
    {
      "path": "/bin/sh",
      "sha256": "eeeeeeeeeeeeeeeeeeeeeeeeeeeeeeeeeeeeeeeeeeeeeeeeeeeeeeeeeeeeeeee",
      "kind": "interpreter"
    },
    {
      "path": "/opt/lingxi/toolchains/typescript/7.0.2/tsc",
      "sha256": "f86e8070c267b12d6c119bf567cb82d8b245e9d93da1864bc7c603cea10a8b2f",
      "kind": "elf",
      "size_bytes": 22872226
    },
    {
      "path": "/usr/bin/git",
      "sha256": "bbbbbbbbbbbbbbbbbbbbbbbbbbbbbbbbbbbbbbbbbbbbbbbbbbbbbbbbbbbbbbbb",
      "kind": "elf"
    },
    {
      "path": "/usr/bin/node",
      "sha256": "abababababababababababababababababababababababababababababababab",
      "kind": "elf"
    },
    {
      "path": "/usr/bin/ssh",
      "sha256": "ffffffffffffffffffffffffffffffffffffffffffffffffffffffffffffffff",
      "kind": "elf"
    },
    {
      "path": "/usr/bin/python3",
      "sha256": "cccccccccccccccccccccccccccccccccccccccccccccccccccccccccccccccc",
      "kind": "interpreter"
    },
    {
      "path": "/usr/lib/libpython3.12.so.1.0",
      "sha256": "dddddddddddddddddddddddddddddddddddddddddddddddddddddddddddddddd",
      "kind": "shared-library"
    }
  ],
  "immutable_files": [
    {
      "path": "/bin/busybox",
      "sha256": "aaaaaaaaaaaaaaaaaaaaaaaaaaaaaaaaaaaaaaaaaaaaaaaaaaaaaaaaaaaaaaaa",
      "kind": "regular-file",
      "size_bytes": 1
    },
    {
      "path": "/bin/sh",
      "sha256": "eeeeeeeeeeeeeeeeeeeeeeeeeeeeeeeeeeeeeeeeeeeeeeeeeeeeeeeeeeeeeeee",
      "kind": "regular-file",
      "size_bytes": 1
    },
    {
      "path": "/opt/lingxi/toolchains/typescript/7.0.2/tsc",
      "sha256": "f86e8070c267b12d6c119bf567cb82d8b245e9d93da1864bc7c603cea10a8b2f",
      "kind": "regular-file",
      "size_bytes": 22872226
    },
    {
      "path": "/usr/bin/git",
      "sha256": "bbbbbbbbbbbbbbbbbbbbbbbbbbbbbbbbbbbbbbbbbbbbbbbbbbbbbbbbbbbbbbbb",
      "kind": "regular-file",
      "size_bytes": 1
    },
    {
      "path": "/usr/bin/node",
      "sha256": "abababababababababababababababababababababababababababababababab",
      "kind": "regular-file",
      "size_bytes": 1
    },
    {
      "path": "/usr/bin/python3",
      "sha256": "cccccccccccccccccccccccccccccccccccccccccccccccccccccccccccccccc",
      "kind": "regular-file",
      "size_bytes": 1
    },
    {
      "path": "/usr/bin/ssh",
      "sha256": "ffffffffffffffffffffffffffffffffffffffffffffffffffffffffffffffff",
      "kind": "regular-file",
      "size_bytes": 1
    },
    {
      "path": "/usr/lib/libpython3.12.so.1.0",
      "sha256": "dddddddddddddddddddddddddddddddddddddddddddddddddddddddddddddddd",
      "kind": "regular-file",
      "size_bytes": 1
    }
  ],
  "writable_paths": [
    "/home/lingxi",
    "/root",
    "/tmp",
    "/var/tmp",
    "/home/lingxi/lingxi"
  ]
}
